<?xml version="1.0" encoding="UTF-8" ?>
<payments xmlns:xsi="http://www.w3.org/2001/XMLSchema-instance" 
xsi:noNamespaceSchemaLocation="payments2.xsd">
    <name dni="12345678A">Javier Toledano</name>
    <birthDate age="23">1998-02-04</birthDate>
    <time>23:55:15</time>
    <time>23:55:15</time>
    <price>123.56</price>
    <amount>678</amount>
    <paid>true</paid>
</payments>